{
  "schema_version": "factory-item-v0.1",
  "id": "WI-002",
  "title": "Bundle snapshot-diff JSON schema",
  "kind": "improvement",
  "state": "delivered",
  "order": 20,
  "source": {
    "avoid_prs": [
      109
    ]
  },
  "acceptance": [
    "all-cli schema snapshot-diff prints the bundled schema",
    "a model contract test validates SnapshotDiffReport JSON against schemas/snapshot-diff-report-v0.1.json",
    "schemas/README.md and README.md document the new schema"
  ],
  "checks": [
    "env -u GOROOT -u GOTOOLDIR go test ./internal/model/... ./schemas/...",
    "env -u GOROOT -u GOTOOLDIR go run ./cmd/all-cli schema snapshot-diff | grep -q snapshot-diff-v0.1"
  ],
  "branch": "factory/wi-002-bundle-snapshot-diff-json-schema",
  "attempts": 1,
  "created_at": "2026-09-28T18:35:43Z",
  "updated_at": "2026-09-28T18:40:22Z",
  "evidence": [
    {
      "ts": "2026-09-28T18:38:28Z",
      "event": "claimed",
      "note": "attempt 1",
      "head": "9dbcb0b"
    },
    {
      "ts": "2026-09-28T18:40:22Z",
      "event": "check",
      "command": "env -u GOROOT -u GOTOOLDIR go test ./internal/model/... ./schemas/...",
      "note": "pass",
      "head": "9dbcb0b",
      "log": ".factory/run/WI-002/20260928T184021Z-check-0.log"
    },
    {
      "ts": "2026-09-28T18:40:22Z",
      "event": "check",
      "command": "env -u GOROOT -u GOTOOLDIR go run ./cmd/all-cli schema snapshot-diff | grep -q snapshot-diff-v0.1",
      "note": "pass",
      "head": "9dbcb0b",
      "log": ".factory/run/WI-002/20260928T184021Z-check-1.log"
    },
    {
      "ts": "2026-09-28T18:40:22Z",
      "event": "verify-pass",
      "head": "9dbcb0b"
    },
    {
      "ts": "2026-09-28T18:40:22Z",
      "event": "deliver",
      "note": "schema + embed + contract test + docs",
      "head": "9dbcb0b"
    }
  ]
}
