{
  "schema_version": "factory-item-v0.1",
  "id": "WI-016",
  "title": "Cover low-coverage adapter paths",
  "kind": "test",
  "state": "queued",
  "order": 97,
  "source": {},
  "acceptance": [
    "gh pickPrimaryHost, opencli Doctor, and aliyun ListProfiles exercise success and failure branches",
    "go test ./internal/tools/gh ./internal/tools/opencli ./internal/tools/aliyun passes"
  ],
  "checks": [
    "env -u GOROOT -u GOTOOLDIR go test ./internal/tools/gh ./internal/tools/opencli ./internal/tools/aliyun"
  ],
  "branch": "factory/wi-016-cover-low-coverage-adapter-paths",
  "attempts": 0,
  "created_at": "2026-09-28T19:00:34Z",
  "updated_at": "2026-09-28T19:00:34Z"
}
