{
  "schema_version": "factory-item-v0.1",
  "id": "WI-078",
  "title": "diagnose: suggest config inspection for config-parse collection errors",
  "kind": "bug",
  "state": "delivered",
  "order": 130,
  "source": {},
  "acceptance": [
    "Collection errors containing a config-file parse signature (kubectl 'error loading config file', gh 'invalid config file') yield an inspect_config_file suggested action instead of rerun_with_timeout"
  ],
  "checks": [
    "env -u GOROOT -u GOTOOLDIR go test ./internal/diagnose/ -count=1"
  ],
  "branch": "factory/wi-078-diagnose-suggest-config-inspection-for-config-parse-collection-errors",
  "attempts": 1,
  "verified": {
    "at": "2026-09-29T01:51:25Z",
    "head": "7130091",
    "fingerprint": "ed18b691eccda6384673b3b45335c7e5478a916a8f3303fca5d74f66606192f2"
  },
  "created_at": "2026-09-29T01:50:23Z",
  "updated_at": "2026-09-29T01:51:26Z",
  "evidence": [
    {
      "ts": "2026-09-29T01:50:23Z",
      "event": "claimed",
      "note": "attempt 1",
      "head": "7130091"
    },
    {
      "ts": "2026-09-29T01:51:25Z",
      "event": "check",
      "command": "env -u GOROOT -u GOTOOLDIR go test ./internal/diagnose/ -count=1",
      "note": "pass",
      "head": "7130091",
      "log": ".factory/run/WI-078/20260929T015124.951036000Z-check-0.log"
    },
    {
      "ts": "2026-09-29T01:51:25Z",
      "event": "verify-pass",
      "head": "7130091"
    },
    {
      "ts": "2026-09-29T01:51:26Z",
      "event": "deliver-check",
      "command": "env -u GOROOT -u GOTOOLDIR go test ./internal/diagnose/ -count=1",
      "note": "pass",
      "head": "7130091",
      "log": ".factory/run/WI-078/20260929T015126.205112000Z-check-0.log"
    },
    {
      "ts": "2026-09-29T01:51:26Z",
      "event": "deliver",
      "head": "7130091"
    }
  ]
}
